{
  "id": "task_20260617_001",
  "created_at": "2026-06-17T13:25:00+08:00",
  "source": "workbuddy",
  "assignee": "codex",
  "type": "system_integration",
  "priority": "high",
  "status": "done",
  "input": {
    "action": "review_shared_protocol_directory",
    "path": "F:/ai/super-jarvis",
    "checklist": [
      "validate_task_schema",
      "validate_memory_schema",
      "validate_decision_schema",
      "read_WORKBUDDY_EXECUTION_FRAMEWORK",
      "suggest_improvements"
    ]
  },
  "expected_output": "protocol_review_and_improvements",
  "requires_user_approval": false,
  "tags": ["infrastructure", "protocol", "review"],
  "result_summary": "Protocol review completed. Report written to F:/ai/super-jarvis/outputs/codex/protocol-review.md."
}
